{"artifact_schema_version":"risk_artifact.v1","calibration_hash":"cccccccccccccccccccccccccccccccccccccccccccccccccccccccccccccccc","code_version":"93e488b02086","config_hash":"c595c31f7a35e0838ee795f8908a269754d6571b24062ee36e14a4833786b1c3","counts":{"n_allow":0,"n_block":3,"n_downsize":0,"n_total":3},"dataset_hash":"bbbbbbbbbbbbbbbbbbbbbbbbbbbbbbbbbbbbbbbbbbbbbbbbbbbbbbbbbbbbbbbb","decision_payload_hash":"752504cf68248288f764b3920c09b7bb1665886ba0938c3cb592962b0e69acc4","decision_policy_hash":null,"forecast_payload_hash":"ffffffffffffffffffffffffffffffffffffffffffffffffffffffffffffffff","generated_at_utc":"2026-02-01T00:00:00+00:00","input_performance_artifact_hash":"f00b3d21e06fe44ce5e5cc6bc16192bbe5cf69b1ab577335ab5ea694bf5856b1","input_performance_run_id":"fc03420691875675acd46f490d0b1649","input_trade_plan_artifact_hash":"de4b0ed51cfb9abe0fd8c92cde2cb9d4824c9aacd916af669c83f1bf84c51af9","input_trade_plan_run_id":"99587b8cecbf59818561c19beb403a90","items":[{"approved_notional_usd":0.0,"category":null,"market_id":"mkt-b","quality_flags":[],"quality_warnings":[],"rank":1,"reason_codes":["performance_concentration_top3_breach"],"requested_notional_usd":25.0,"side":"BUY_NO","token_id":"tok-b","verdict":"BLOCK"},{"approved_notional_usd":0.0,"category":null,"market_id":"mkt-f","quality_flags":[],"quality_warnings":[],"rank":2,"reason_codes":["performance_concentration_top3_breach"],"requested_notional_usd":25.0,"side":"BUY_NO","token_id":"tok-f","verdict":"BLOCK"},{"approved_notional_usd":0.0,"category":null,"market_id":"mkt-a","quality_flags":[],"quality_warnings":[],"rank":3,"reason_codes":["performance_concentration_top3_breach"],"requested_notional_usd":25.0,"side":"BUY_YES","token_id":"tok-a","verdict":"BLOCK"}],"items_hash":"1a5ea0fd190c6dc2d6dd35af34e650df712bfda354541ce19cf74650bea3bfa3","model_hash":"9999999999999999999999999999999999999999999999999999999999999999","notional_summary":{"approved_total_usd":0.0,"blocked_total_usd":75.0,"requested_total_usd":75.0},"params":{"allow_downsize":true,"blocking_quality_flags":["conformal_degenerate_intervals","conformal_invalid_intervals","illiquid","insufficient_calibration_data","insufficient_data","insufficient_uncertainty_data","poor_calibration","stale"],"cooldown_block_flags":["critical_drawdown","critical_liquidity","critical_loss"],"max_notional_per_category_usd":2000.0,"max_notional_per_market_usd":500.0,"max_total_notional_usd":5000.0,"min_notional_usd":5.0,"performance_top1_cap":0.5,"performance_top3_cap":0.8,"top1_share_cap":0.5,"top3_share_cap":0.8},"policy_hash":"4a6695b60edd2fc481569ad7e63ee3182f187b1f05e0635afe1caaf5aef38874","quality_flags":["performance_concentration_top3_breach"],"quality_warnings":[{"code":"performance_concentration_top3_breach","message":"Historical top3 share 1.000000 exceeds cap 0.800000."}],"risk_payload_hash":"7680747a97b554bfd3a32f234e57bd82f2aec2ba1cf9cc522cba0e3580e0127b","risk_policy_version":"risk_policy.v1","run_id":"a1da31b031e251d39e60eff59ee3bef0","trade_plan_payload_hash":"de4b0ed51cfb9abe0fd8c92cde2cb9d4824c9aacd916af669c83f1bf84c51af9","trade_plan_policy_hash":"d58c1a0453df9f6a0e4ca970646c714f1a4c84a792d0ffd82ee1d3ef03f79fbd","uncertainty_hash":"eeeeeeeeeeeeeeeeeeeeeeeeeeeeeeeeeeeeeeeeeeeeeeeeeeeeeeeeeeeeeeee"}