{"artifact_schema_version":"risk_artifact.v1","calibration_hash":"4f53cda18c2baa0c0354bb5f9a3ecbe5ed12ab4d8e11ba873c2f11161202b945","code_version":"93e488b02086","config_hash":"139abdfe524de0e9991aabc05a44b3888bf44db1dbbe54ac1425641dade9b6f8","counts":{"n_allow":0,"n_block":0,"n_downsize":0,"n_total":0},"dataset_hash":"4f53cda18c2baa0c0354bb5f9a3ecbe5ed12ab4d8e11ba873c2f11161202b945","decision_payload_hash":"2b86d00e3cc2941454d6065b4e265272a174f9037f1334b15c7fed82763cdfa9","decision_policy_hash":null,"forecast_payload_hash":"4f53cda18c2baa0c0354bb5f9a3ecbe5ed12ab4d8e11ba873c2f11161202b945","generated_at_utc":"2026-02-16T06:22:13+00:00","input_performance_artifact_hash":"c5077cf6f42ff118e01e2a39e9219d8c3b5187493d213dd1209995996ba5a3e1","input_performance_run_id":"f3f67f96ca07595d93904e74c30fa58f","input_trade_plan_artifact_hash":"421b19ba7baf72161456164a0d5985767339ccc2e1f534819f7e4d44f3e23c25","input_trade_plan_run_id":"4dd16d5b7dec55d180b7c05b53c949f8","items":[],"items_hash":"4f53cda18c2baa0c0354bb5f9a3ecbe5ed12ab4d8e11ba873c2f11161202b945","model_hash":"5fefc094e744f012e566c8ecad5bf2331b43068d1c65056af8d72a621d6fa7de","notional_summary":{"approved_total_usd":0.0,"blocked_total_usd":0.0,"requested_total_usd":0.0},"params":{"allow_downsize":true,"blocking_quality_flags":["conformal_degenerate_intervals","conformal_invalid_intervals","illiquid","insufficient_calibration_data","insufficient_data","insufficient_uncertainty_data","poor_calibration","stale"],"cooldown_block_flags":["critical_drawdown","critical_liquidity","critical_loss"],"max_notional_per_category_usd":2000.0,"max_notional_per_market_usd":500.0,"max_total_notional_usd":5000.0,"min_notional_usd":5.0,"performance_top1_cap":0.5,"performance_top3_cap":0.8,"top1_share_cap":0.5,"top3_share_cap":0.8},"policy_hash":"4a6695b60edd2fc481569ad7e63ee3182f187b1f05e0635afe1caaf5aef38874","quality_flags":[],"quality_warnings":[],"risk_payload_hash":"c7f439f8d36f3853bd06232996d3b4301874d9c49fa823d321530f4bf8062808","risk_policy_version":"risk_policy.v1","run_id":"414e29de2d895326a6f6ea423f9b7898","trade_plan_payload_hash":"421b19ba7baf72161456164a0d5985767339ccc2e1f534819f7e4d44f3e23c25","trade_plan_policy_hash":"d58c1a0453df9f6a0e4ca970646c714f1a4c84a792d0ffd82ee1d3ef03f79fbd","uncertainty_hash":"4f53cda18c2baa0c0354bb5f9a3ecbe5ed12ab4d8e11ba873c2f11161202b945"}