{"artifact_schema_version":"risk_artifact.v1","calibration_hash":"4f53cda18c2baa0c0354bb5f9a3ecbe5ed12ab4d8e11ba873c2f11161202b945","code_version":"93e488b02086","config_hash":"a01a8f34c26737c9c04bf75180c126fb351521bc35299610404d26e82dba4cdf","counts":{"n_allow":0,"n_block":0,"n_downsize":0,"n_total":0},"dataset_hash":"4f53cda18c2baa0c0354bb5f9a3ecbe5ed12ab4d8e11ba873c2f11161202b945","decision_payload_hash":"fd91cc39434a0e38c20e8d5640bb1a233df2bd9f67d96a653c480265a01c6ec9","decision_policy_hash":null,"forecast_payload_hash":"4f53cda18c2baa0c0354bb5f9a3ecbe5ed12ab4d8e11ba873c2f11161202b945","generated_at_utc":"2026-02-16T06:22:13+00:00","input_performance_artifact_hash":"4ab18d4f94fc38a5b833cd215cb704f4611f0b0a6e16c0d52cad3ecdc0a93585","input_performance_run_id":"97e4b2e448e55c20a89f65f3e70df6b0","input_trade_plan_artifact_hash":"c0b69bd09729bf2136a02d9c7ded8679228ca9a100252e9bea175bbaa28753c2","input_trade_plan_run_id":"99c96ea5a48956808365543981fdd3bd","items":[],"items_hash":"4f53cda18c2baa0c0354bb5f9a3ecbe5ed12ab4d8e11ba873c2f11161202b945","model_hash":"5fefc094e744f012e566c8ecad5bf2331b43068d1c65056af8d72a621d6fa7de","notional_summary":{"approved_total_usd":0.0,"blocked_total_usd":0.0,"requested_total_usd":0.0},"params":{"allow_downsize":true,"blocking_quality_flags":["conformal_degenerate_intervals","conformal_invalid_intervals","illiquid","insufficient_calibration_data","insufficient_data","insufficient_uncertainty_data","poor_calibration","stale"],"cooldown_block_flags":["critical_drawdown","critical_liquidity","critical_loss"],"max_notional_per_category_usd":2000.0,"max_notional_per_market_usd":500.0,"max_total_notional_usd":5000.0,"min_notional_usd":5.0,"performance_top1_cap":0.5,"performance_top3_cap":0.8,"top1_share_cap":0.5,"top3_share_cap":0.8},"policy_hash":"4a6695b60edd2fc481569ad7e63ee3182f187b1f05e0635afe1caaf5aef38874","quality_flags":[],"quality_warnings":[],"risk_payload_hash":"245e9e9828c0029d768c1aa5208ce7b8a0f4546bf8b40a7e639eee33b1083f24","risk_policy_version":"risk_policy.v1","run_id":"b36c65ba243c5d0986b5c147bb3efae6","trade_plan_payload_hash":"c0b69bd09729bf2136a02d9c7ded8679228ca9a100252e9bea175bbaa28753c2","trade_plan_policy_hash":"d58c1a0453df9f6a0e4ca970646c714f1a4c84a792d0ffd82ee1d3ef03f79fbd","uncertainty_hash":"4f53cda18c2baa0c0354bb5f9a3ecbe5ed12ab4d8e11ba873c2f11161202b945"}