{"artifact_schema_version":"risk_artifact.v1","calibration_hash":"4f53cda18c2baa0c0354bb5f9a3ecbe5ed12ab4d8e11ba873c2f11161202b945","code_version":"93e488b02086","config_hash":"24136522499e7c84d9cf7a3acc06ab3ba08f2ed368a3565ebe15a121ecd25f86","counts":{"n_allow":0,"n_block":0,"n_downsize":0,"n_total":0},"dataset_hash":"4f53cda18c2baa0c0354bb5f9a3ecbe5ed12ab4d8e11ba873c2f11161202b945","decision_payload_hash":"da4b96b3b10807cb8eba7076c4fafe4d459a784e0b9175b937a2c73b485c0dfc","decision_policy_hash":null,"forecast_payload_hash":"4f53cda18c2baa0c0354bb5f9a3ecbe5ed12ab4d8e11ba873c2f11161202b945","generated_at_utc":"2026-03-10T00:00:00+00:00","input_performance_artifact_hash":"0f08eaffec66839f243a2cad10a0456242c437fc585c6fd36b29ad4fc148aeb0","input_performance_run_id":"4db5a92e9ea75e07887e75355689d1ef","input_trade_plan_artifact_hash":"34e0c3a8826c29047c92191be8fbb557f09387afeff135ed1ee14c533a988859","input_trade_plan_run_id":"bd362872ede5592c9f0ed74664867077","items":[],"items_hash":"4f53cda18c2baa0c0354bb5f9a3ecbe5ed12ab4d8e11ba873c2f11161202b945","model_hash":"5fefc094e744f012e566c8ecad5bf2331b43068d1c65056af8d72a621d6fa7de","notional_summary":{"approved_total_usd":0.0,"blocked_total_usd":0.0,"requested_total_usd":0.0},"params":{"allow_downsize":true,"blocking_quality_flags":["conformal_degenerate_intervals","conformal_invalid_intervals","illiquid","insufficient_calibration_data","insufficient_data","insufficient_uncertainty_data","poor_calibration","stale"],"cooldown_block_flags":["critical_drawdown","critical_liquidity","critical_loss"],"max_notional_per_category_usd":2000.0,"max_notional_per_market_usd":500.0,"max_total_notional_usd":5000.0,"min_notional_usd":5.0,"performance_top1_cap":0.5,"performance_top3_cap":0.8,"top1_share_cap":0.5,"top3_share_cap":0.8},"policy_hash":"4a6695b60edd2fc481569ad7e63ee3182f187b1f05e0635afe1caaf5aef38874","quality_flags":[],"quality_warnings":[],"risk_payload_hash":"7c9875d5a8b8ee3a4e1738d66a163d29470c57225563b6482fa28cb342fac32f","risk_policy_version":"risk_policy.v1","run_id":"78df8eb06abd5eaa922689785d16c5d4","trade_plan_payload_hash":"34e0c3a8826c29047c92191be8fbb557f09387afeff135ed1ee14c533a988859","trade_plan_policy_hash":"d58c1a0453df9f6a0e4ca970646c714f1a4c84a792d0ffd82ee1d3ef03f79fbd","uncertainty_hash":"4f53cda18c2baa0c0354bb5f9a3ecbe5ed12ab4d8e11ba873c2f11161202b945"}