{
  "artifact_schema_version": "risk_artifact.v1",
  "run_id": "risk-run-critical",
  "generated_at_utc": "2026-02-12T00:00:00+00:00",
  "code_version": "risk-code",
  "config_hash": "aaaaaaaaaaaaaaaaaaaaaaaaaaaaaaaaaaaaaaaaaaaaaaaaaaaaaaaaaaaaaaaa",
  "input_trade_plan_artifact_hash": "bbbbbbbbbbbbbbbbbbbbbbbbbbbbbbbbbbbbbbbbbbbbbbbbbbbbbbbbbbbbbbbb",
  "risk_policy_version": "risk_policy.v1",
  "params": {
    "max_total_notional_usd": 5000.0,
    "max_notional_per_market_usd": 500.0,
    "max_notional_per_category_usd": 2000.0,
    "top1_share_cap": 0.5,
    "top3_share_cap": 0.8,
    "performance_top1_cap": 0.5,
    "performance_top3_cap": 0.8,
    "allow_downsize": true,
    "min_notional_usd": 5.0
  },
  "items": [
    {
      "rank": 1,
      "market_id": "mkt-a",
      "token_id": "tok-a",
      "side": "BUY_YES",
      "requested_notional_usd": 100.0,
      "approved_notional_usd": 0.0,
      "verdict": "BLOCK",
      "reason_codes": [
        "blocked_by_quality_flag:critical_loss"
      ],
      "quality_flags": [
        "critical_loss"
      ],
      "quality_warnings": []
    }
  ],
  "counts": {
    "n_total": 1,
    "n_allow": 0,
    "n_block": 1,
    "n_downsize": 0
  },
  "notional_summary": {
    "requested_total_usd": 100.0,
    "approved_total_usd": 0.0,
    "blocked_total_usd": 100.0
  },
  "quality_flags": [
    "critical_loss"
  ],
  "quality_warnings": [
    {
      "code": "critical_loss",
      "message": "Critical loss flag active."
    }
  ],
  "policy_hash": "cccccccccccccccccccccccccccccccccccccccccccccccccccccccccccccccc",
  "items_hash": "dddddddddddddddddddddddddddddddddddddddddddddddddddddddddddddddd",
  "risk_payload_hash": "eeeeeeeeeeeeeeeeeeeeeeeeeeeeeeeeeeeeeeeeeeeeeeeeeeeeeeeeeeeeeeee"
}
