{"artifact_schema_version":"risk_artifact.v1","calibration_hash":"cccccccccccccccccccccccccccccccccccccccccccccccccccccccccccccccc","code_version":"93e488b02086","config_hash":"129f243258332c6cf61be2dd5758d6a0192dc652f6a4ba5dd1e09ea6f07a1711","counts":{"n_allow":0,"n_block":3,"n_downsize":0,"n_total":3},"dataset_hash":"bbbbbbbbbbbbbbbbbbbbbbbbbbbbbbbbbbbbbbbbbbbbbbbbbbbbbbbbbbbbbbbb","decision_payload_hash":"491ab75101fda028430cf92023c41f34786fc3b6bb74b4cd8e4efb854644c831","decision_policy_hash":null,"forecast_payload_hash":"ffffffffffffffffffffffffffffffffffffffffffffffffffffffffffffffff","generated_at_utc":"2026-02-01T00:00:00+00:00","input_performance_artifact_hash":"8947461dee218a996a919f0454f2d93392338e541633ba6f5cb4f63ed8ac8a3b","input_performance_run_id":"c6662c9576ac5bf49c57eee28c34c40c","input_trade_plan_artifact_hash":"3d974a9e5a6abf98a495442e7432547691d9026c6f7906540f92b39d08d1956a","input_trade_plan_run_id":"8e7da4a9d9f15eba81539f677975749e","items":[{"approved_notional_usd":0.0,"category":null,"market_id":"mkt-b","quality_flags":[],"quality_warnings":[],"rank":1,"reason_codes":["performance_concentration_top3_breach"],"requested_notional_usd":25.0,"side":"BUY_NO","token_id":"tok-b","verdict":"BLOCK"},{"approved_notional_usd":0.0,"category":null,"market_id":"mkt-f","quality_flags":[],"quality_warnings":[],"rank":2,"reason_codes":["performance_concentration_top3_breach"],"requested_notional_usd":25.0,"side":"BUY_NO","token_id":"tok-f","verdict":"BLOCK"},{"approved_notional_usd":0.0,"category":null,"market_id":"mkt-a","quality_flags":[],"quality_warnings":[],"rank":3,"reason_codes":["performance_concentration_top3_breach"],"requested_notional_usd":25.0,"side":"BUY_YES","token_id":"tok-a","verdict":"BLOCK"}],"items_hash":"1a5ea0fd190c6dc2d6dd35af34e650df712bfda354541ce19cf74650bea3bfa3","model_hash":"9999999999999999999999999999999999999999999999999999999999999999","notional_summary":{"approved_total_usd":0.0,"blocked_total_usd":75.0,"requested_total_usd":75.0},"params":{"allow_downsize":true,"blocking_quality_flags":["conformal_degenerate_intervals","conformal_invalid_intervals","illiquid","insufficient_calibration_data","insufficient_data","insufficient_uncertainty_data","poor_calibration","stale"],"cooldown_block_flags":["critical_drawdown","critical_liquidity","critical_loss"],"max_notional_per_category_usd":2000.0,"max_notional_per_market_usd":500.0,"max_total_notional_usd":5000.0,"min_notional_usd":5.0,"performance_top1_cap":0.5,"performance_top3_cap":0.8,"top1_share_cap":0.5,"top3_share_cap":0.8},"policy_hash":"4a6695b60edd2fc481569ad7e63ee3182f187b1f05e0635afe1caaf5aef38874","quality_flags":["performance_concentration_top3_breach"],"quality_warnings":[{"code":"performance_concentration_top3_breach","message":"Historical top3 share 1.000000 exceeds cap 0.800000."}],"risk_payload_hash":"0fc377c5226cb30d68ef6a2478a18e8e83cf975f1493c229502296ac545fd22c","risk_policy_version":"risk_policy.v1","run_id":"ea90bb11e20f510e9463fec0e4ee9fcd","trade_plan_payload_hash":"3d974a9e5a6abf98a495442e7432547691d9026c6f7906540f92b39d08d1956a","trade_plan_policy_hash":"d58c1a0453df9f6a0e4ca970646c714f1a4c84a792d0ffd82ee1d3ef03f79fbd","uncertainty_hash":"eeeeeeeeeeeeeeeeeeeeeeeeeeeeeeeeeeeeeeeeeeeeeeeeeeeeeeeeeeeeeeee"}