{"artifact_schema_version":"risk_artifact.v1","calibration_hash":"cccccccccccccccccccccccccccccccccccccccccccccccccccccccccccccccc","code_version":"93e488b02086","config_hash":"18194027a442d50ea2b39ad03f447ba7208cf644721d6bf17b55de42c424873d","counts":{"n_allow":0,"n_block":3,"n_downsize":0,"n_total":3},"dataset_hash":"bbbbbbbbbbbbbbbbbbbbbbbbbbbbbbbbbbbbbbbbbbbbbbbbbbbbbbbbbbbbbbbb","decision_payload_hash":"9ffb9530d57265bb776d9d6d14d67c47d61fbd2e3ee44ccd4e86db1e7d6d0c66","decision_policy_hash":null,"forecast_payload_hash":"ffffffffffffffffffffffffffffffffffffffffffffffffffffffffffffffff","generated_at_utc":"2026-02-01T00:00:00+00:00","input_performance_artifact_hash":"c69922a68c2af51e45a7ccb264bf3c71b6e5ee69710a3821bcd2e154c008b04d","input_performance_run_id":"60623389e28556389848db880aa951af","input_trade_plan_artifact_hash":"bfee8ab1044ef038b05cd3025015677365be45086a038281830bfb6c8e079064","input_trade_plan_run_id":"5773412fa8cb5687b5832542b7c65ad4","items":[{"approved_notional_usd":0.0,"category":null,"market_id":"mkt-b","quality_flags":[],"quality_warnings":[],"rank":1,"reason_codes":["performance_concentration_top3_breach"],"requested_notional_usd":25.0,"side":"BUY_NO","token_id":"tok-b","verdict":"BLOCK"},{"approved_notional_usd":0.0,"category":null,"market_id":"mkt-f","quality_flags":[],"quality_warnings":[],"rank":2,"reason_codes":["performance_concentration_top3_breach"],"requested_notional_usd":25.0,"side":"BUY_NO","token_id":"tok-f","verdict":"BLOCK"},{"approved_notional_usd":0.0,"category":null,"market_id":"mkt-a","quality_flags":[],"quality_warnings":[],"rank":3,"reason_codes":["performance_concentration_top3_breach"],"requested_notional_usd":25.0,"side":"BUY_YES","token_id":"tok-a","verdict":"BLOCK"}],"items_hash":"1a5ea0fd190c6dc2d6dd35af34e650df712bfda354541ce19cf74650bea3bfa3","model_hash":"9999999999999999999999999999999999999999999999999999999999999999","notional_summary":{"approved_total_usd":0.0,"blocked_total_usd":75.0,"requested_total_usd":75.0},"params":{"allow_downsize":true,"blocking_quality_flags":["conformal_degenerate_intervals","conformal_invalid_intervals","illiquid","insufficient_calibration_data","insufficient_data","insufficient_uncertainty_data","poor_calibration","stale"],"cooldown_block_flags":["critical_drawdown","critical_liquidity","critical_loss"],"max_notional_per_category_usd":2000.0,"max_notional_per_market_usd":500.0,"max_total_notional_usd":5000.0,"min_notional_usd":5.0,"performance_top1_cap":0.5,"performance_top3_cap":0.8,"top1_share_cap":0.5,"top3_share_cap":0.8},"policy_hash":"4a6695b60edd2fc481569ad7e63ee3182f187b1f05e0635afe1caaf5aef38874","quality_flags":["performance_concentration_top3_breach"],"quality_warnings":[{"code":"performance_concentration_top3_breach","message":"Historical top3 share 1.000000 exceeds cap 0.800000."}],"risk_payload_hash":"d75d4f61cef96b6d1103ff3d51e1a7aa94a45d54085ceaaed7004dffa0e816a7","risk_policy_version":"risk_policy.v1","run_id":"96a62dd0a7e257a3b71ed7f9f5e6209b","trade_plan_payload_hash":"bfee8ab1044ef038b05cd3025015677365be45086a038281830bfb6c8e079064","trade_plan_policy_hash":"d58c1a0453df9f6a0e4ca970646c714f1a4c84a792d0ffd82ee1d3ef03f79fbd","uncertainty_hash":"eeeeeeeeeeeeeeeeeeeeeeeeeeeeeeeeeeeeeeeeeeeeeeeeeeeeeeeeeeeeeeee"}