{"artifact_schema_version":"risk_artifact.v1","calibration_hash":"4f53cda18c2baa0c0354bb5f9a3ecbe5ed12ab4d8e11ba873c2f11161202b945","code_version":"93e488b02086","config_hash":"d7e7077cf286df2e1f21a17397e54a62f6a20cbf7963d963d18ea7fedc963c9c","counts":{"n_allow":0,"n_block":0,"n_downsize":0,"n_total":0},"dataset_hash":"4f53cda18c2baa0c0354bb5f9a3ecbe5ed12ab4d8e11ba873c2f11161202b945","decision_payload_hash":"95efaaf00abf1b52b9c7641fb14abfdc3cc391b8f6a05946aa1313760bda0bc3","decision_policy_hash":null,"forecast_payload_hash":"4f53cda18c2baa0c0354bb5f9a3ecbe5ed12ab4d8e11ba873c2f11161202b945","generated_at_utc":"2026-02-16T06:22:13+00:00","input_performance_artifact_hash":"b4a87652ad88bbd49f579768569376db5694a2c367c568e16a623dea1d57bb27","input_performance_run_id":"678bc6ddecd15b0a811360750dce928e","input_trade_plan_artifact_hash":"80358cdfbc88107c705eb9514070e60d234d355bbd563c25486925735ae18566","input_trade_plan_run_id":"c99c7552207c5d2d8fd4cc79f77d828d","items":[],"items_hash":"4f53cda18c2baa0c0354bb5f9a3ecbe5ed12ab4d8e11ba873c2f11161202b945","model_hash":"5fefc094e744f012e566c8ecad5bf2331b43068d1c65056af8d72a621d6fa7de","notional_summary":{"approved_total_usd":0.0,"blocked_total_usd":0.0,"requested_total_usd":0.0},"params":{"allow_downsize":true,"blocking_quality_flags":["conformal_degenerate_intervals","conformal_invalid_intervals","illiquid","insufficient_calibration_data","insufficient_data","insufficient_uncertainty_data","poor_calibration","stale"],"cooldown_block_flags":["critical_drawdown","critical_liquidity","critical_loss"],"max_notional_per_category_usd":2000.0,"max_notional_per_market_usd":500.0,"max_total_notional_usd":5000.0,"min_notional_usd":5.0,"performance_top1_cap":0.5,"performance_top3_cap":0.8,"top1_share_cap":0.5,"top3_share_cap":0.8},"policy_hash":"4a6695b60edd2fc481569ad7e63ee3182f187b1f05e0635afe1caaf5aef38874","quality_flags":[],"quality_warnings":[],"risk_payload_hash":"bb92745ed4e44af50afc70a33dab5026faac3b1f27081b3f4aa7b47417f5e039","risk_policy_version":"risk_policy.v1","run_id":"81b0370e335556f9b25859ae206d0050","trade_plan_payload_hash":"80358cdfbc88107c705eb9514070e60d234d355bbd563c25486925735ae18566","trade_plan_policy_hash":"d58c1a0453df9f6a0e4ca970646c714f1a4c84a792d0ffd82ee1d3ef03f79fbd","uncertainty_hash":"4f53cda18c2baa0c0354bb5f9a3ecbe5ed12ab4d8e11ba873c2f11161202b945"}